{"schema_version":"1.0.0","processo_cnj":"0000001-00.2026.4.00.0001","tipo_pericia":"VICIOS_CONSTRUTIVOS","status_execucao":"AGUARDANDO_DADOS_DE_VISTORIA","manifestacoes":[],"hipoteses":[],"patologias":[],"questoes_saneadas":[],"cobertura_quesitos":[],"pesquisa_online":{"status":"NAO_NECESSARIA","pesquisas_realizadas":0,"fontes_oficiais_localizadas":[],"fontes_rejeitadas":[],"fontes_cacheadas":[],"revalidacoes_vigencia":0,"pesquisas_desnecessarias_evitadas":1},"autoauditoria":[],"autonomia":{"decisoes_autonomas":1,"hipoteses_criadas":0,"hipoteses_testadas":0,"pesquisas_autonomas":0,"normas_recuperadas":0,"fontes_online_recuperadas":0,"lacunas_resolvidas":0,"ressalvas_criadas":0,"perguntas_evitadas":["Pergunta fictícia evitada."],"perguntas_necessarias":[]},"gate_redacao":"BLOQUEADO_PARA_REDACAO","proveniencia":["processo.json"]}
